[
  {
    "claim": "Production-host evidence is available.",
    "collected_at": "2026-01-01T00:00:00Z",
    "collected_by": "deterministic_local",
    "content_hash": "sha256:440a544b0155b135d4f2415fb5ae6a8805cfee5822e3489689973a3c7709bf18",
    "evidence_id": "evidence.analysis",
    "evidence_type": "authority_document",
    "locator": {
      "kind": "artifact_id",
      "value": "evidence.analysis"
    },
    "payload_summary": "",
    "schema_version": "1.0.0",
    "source": {
      "evidence_status": "verified",
      "location": "fixture",
      "source_id": "source.evidence.analysis",
      "source_type": "user_intent"
    },
    "visibility": "analysis_input"
  }
]
